Title,MediaUrl,Description,Type,Country,Year,ExpertRating,Genres,Actors
Al Hayba,https://th.bing.com/th/id/OIP.j1IziQ2s3dBPlPlXiXgwOQAAAA?rs=1&pid=ImgDetMain,A powerful Lebanese-Syrian series following a mafia family in a border town.,s,Lebanon/Syria,2017,8.7,"Drama,Action","Taim Hasan,Nadine Nassib Njeim,Abdo Shaheen"
Stiletto,https://tse2.mm.bing.net/th/id/OIP.TGD9tsQFhHwwD6bPqAtrggHaHH?rs=1&pid=ImgDetMain,A high-society murder mystery involving secrets, affairs, and betrayals.,s,Lebanon/Syria,2022,8.2,"Mystery,Drama","Samer Ismail,Karol El Hajj,Nada Abou Farhat"
Al Thaman,https://tse1.mm.bing.net/th/id/OIP.iwYQHdod6dsbXnr3pfKTaAHaHa?rs=1&pid=ImgDetMain,A touching story about a mother's sacrifice and complex relationships.,s,Lebanon,2023,8.0,"Drama,Romance","Bassel Khayat,Razane Jammal,Nicolas Mouawad"
Till Death,https://tse3.mm.bing.net/th/id/OIP.uMEA-d7tfSM08qSMDZX_GAHaJQ?rs=1&pid=ImgDetMain,A romantic thriller exploring the limits of love, manipulation, and revenge.,s,Lebanon,2021,8.4,"Thriller,Romance","Maguy Bou Ghosn,Daniella Rahme,Mohammed Al-Ahmad"
Joman,https://artworks.thetvdb.com/banners/posters/5da3d06a05fcb.jpg,A romantic drama revolving around intense love and sacrifice.,s,Lebanon,2020,7.7,"Drama,Romance","Valerie Abou Chacra, Mohammed Al-Ahmad"
Wa Akheeran,https://static.tvmaze.com/uploads/images/original_untouched/455/1139496.jpg,A suspenseful drama involving a woman’s quest for justice.,s,Lebanon,2020,7.8,"Drama,Thriller","Kosai Khauli,Nadine Nassib Njeim"
Salon Zahra,https://images.justwatch.com/poster/252895019/s718/season-1.%7Bformat%7D,A heartwarming series combining comedy and drama in a neighborhood beauty salon.,s,Lebanon,2021,8.3,"Comedy,Drama","Nadine Nassib Njeim,Mutasem Al Nahar"
Bil Dam,https://is1-ssl.mzstatic.com/image/thumb/Music221/v4/23/fb/2b/23fb2b82-c923-8411-d325-32ac644b6e6e/5283024038517_Cover.jpg/1200x1200bf-60.jpg,A gritty crime drama exploring family and betrayal.,s,Lebanon,2023,7.9,"Crime,Drama","Abed Fahed,Anjo Rihane"
Tango,https://tse2.mm.bing.net/th/id/OIP.7ZFHXAObk47HVyNYjcTI9AAAAA?w=320&h=400&rs=1&pid=ImgDetMain,A web of love, lies, and secrets between two couples.,s,Lebanon,2018,8.1,"Drama,Romance","Bassem Yakhour,Daniella Rahme"
Cello,https://tse4.mm.bing.net/th/id/OIP.Qpoqf0_meIWUBkf1NeUA8gAAAA?pid=ImgDet&w=192&h=257&c=7,A story of music, ambition, and the high price of success.,s,Lebanon,2020,7.6,"Drama,Music","Youssef El Khal,Nadine Nassib Njeim,Taim Hasan"
Cristal,https://tse4.mm.bing.net/th/id/OIP.ZqWb7qL0hokRoqWLkxzegAAAAA?w=236&h=314&rs=1&pid=ImgDetMain,An Arabic adaptation of a Latin American drama centered around wealth, rivalry, and love.,s,Lebanon,2023,8.0,"Drama,Romance","Pamela El Kik,Stephanie Atala,Khaled El Nabawy"
Nos Youm,https://dol9cswr8axcx.cloudfront.net/series/large/1431837.jpg,A suspenseful drama involving deception, identity, and survival.,s,Lebanon,2016,8.1,"Drama,Thriller","Youssef El Khal,Nadine Nassib Njeim"
Ma Fiye,https://m.media-amazon.com/images/M/MV5BOGVjODA3MTYtZjIxMy00NzgwLWIyOGQtYmUwZjhiZGZhNmIxXkEyXkFqcGdeQXVyMTIzMDgxNzgx._V1_FMjpg_UX1000_.jpg,A romantic series exploring emotional trauma and second chances.,s,Lebanon,2019,8.2,"Drama,Romance","Valerie Abou Chacra,Ahmed Fahmi"